{
  "name": "Disruption Intelligence Agent",
  "slug": "disruption_intelligence_agent",
  "status": "AUDIT_CANDIDATE",
  "plane": "fmi",
  "proposed_class": "hybrid_agent",
  "mission": "detect weather, infrastructure, border, port, and rail disruptions",
  "explicit_non_scope": [
    "emergency authority",
    "route command"
  ],
  "graph_membership": [
    "FMI-G04"
  ],
  "candidate_commands": [
    "none_without_separate_command_contract"
  ],
  "production_logistics_authority": false,
  "certification": "NOT_J0",
  "audit_required": true
}
