{
  "name": "Ocean & Port Intelligence Agent",
  "slug": "ocean_port_intelligence_agent",
  "status": "AUDIT_CANDIDATE",
  "plane": "fmi",
  "proposed_class": "hybrid_agent",
  "mission": "synthesize ocean/port capacity, congestion, and disruption signals",
  "explicit_non_scope": [
    "ocean contracting",
    "booking authority"
  ],
  "graph_membership": [
    "FMI-G04"
  ],
  "candidate_commands": [
    "none_without_separate_command_contract"
  ],
  "production_logistics_authority": false,
  "certification": "NOT_J0",
  "audit_required": true
}
