{
  "name": "Rate Intelligence Agent",
  "slug": "rate_intelligence_agent",
  "status": "AUDIT_CANDIDATE",
  "plane": "fmi",
  "proposed_class": "hybrid_agent",
  "mission": "normalize and analyze market rate signals",
  "explicit_non_scope": [
    "authorized quote",
    "load acceptance",
    "price commitment"
  ],
  "graph_membership": [
    "FMI-G03"
  ],
  "candidate_commands": [
    "none_without_separate_command_contract"
  ],
  "production_logistics_authority": false,
  "certification": "NOT_J0",
  "audit_required": true
}
